<?xml version="1.0" encoding="UTF-8"?>
<!DOCTYPE xml>
<tns:testSuite xmlns:tns="http://www.xmlium.org/xsd/1.0/TestSuite" xmlns:xsi="http://www.w3.org/2001/XMLSchema-instance" xsi:schemaLocation="http://www.xmlium.org/xsd/1.0/TestSuite http://www.xmlium.org/xsd/1.0/TestSuite.xsd">
  <tns:testCase>
  	<tns:configFile>/com/example/test/base/config.xml</tns:configFile>
   	<tns:get></tns:get>
   	<tns:currentTest>/com/example/test/base/login.xml</tns:currentTest>
   	<tns:currentTest>/com/example/test/createPortfoliosOnEmptyPortfolioSet.xml</tns:currentTest>
	<tns:currentTest>/com/example/test/positionDetailsTest.xml</tns:currentTest>
	<tns:currentTest>/com/example/test/deleteAllAvailablePortfolios.xml</tns:currentTest>
	<tns:currentTest>/com/example/test/testKOM56.xml</tns:currentTest>
	<tns:currentTest>/com/example/test/testKOM73.xml</tns:currentTest>
	<tns:currentTest>/com/example/test/testKOM77.xml</tns:currentTest>
	<tns:currentTest>/com/example/test/testKOM79.xml</tns:currentTest>
	<tns:currentTest>/com/example/test/testKOM80.xml</tns:currentTest>
	<tns:currentTest>/com/example/test/testKOM86.xml</tns:currentTest>
  </tns:testCase>
</tns:testSuite>